{
  "assignment_id": "945c3dffcf3751f283a9bb027c0910a9",
  "extractor_version": "palette_v1_c31",
  "instrument": "surge_xt",
  "pinned_state": {
    "parameter_dict": {
      "Amp EG Attack": 0.05,
      "Amp EG Release": 0.4,
      "Filter Cutoff": 0.62,
      "Filter Resonance": 0.35,
      "Osc 1 Type": "Classic",
      "Output Level": 0.8
    },
    "plugin_name": "Surge XT",
    "plugin_version": "1.3.4",
    "preset_name_optional": "Init Saw Lead"
  },
  "provenance_pointers": [
    "rule_0271c7a9f3b5f606"
  ],
  "schema_v": "palette_v1",
  "stem": "bass"
}
