{
  "assignment_id": "1f158d1f7c4d573f9ede42d2e5dd12e1",
  "extractor_version": "palette_v1_c31",
  "instrument": "fluidsynth_gm",
  "notes_optional": "GM standard drum kit variant, alternate rhythm rule.",
  "pinned_state": {
    "parameter_dict": {
      "bank": 0,
      "gain": 0.91,
      "preset_num": 33
    },
    "plugin_name": "fluidsynth",
    "plugin_version": "2.3.4"
  },
  "provenance_pointers": [
    "rule_d85d957a8f59f9f6"
  ],
  "schema_v": "palette_v1",
  "stem": "drums"
}
