{
  "assignment_id": "b29ac4b03bc250bdad10d08075ea8260",
  "extractor_version": "palette_v1_c31",
  "instrument": "surge_xt",
  "notes_optional": "Surge XT synth hihat variant.",
  "pinned_state": {
    "parameter_dict": {
      "Amp EG Attack": 0.05,
      "Amp EG Release": 0.4,
      "Filter Cutoff": 0.64,
      "Filter Resonance": 0.35,
      "Osc 1 Type": "Classic",
      "Output Level": 0.8
    },
    "plugin_name": "Surge XT",
    "plugin_version": "1.3.4",
    "preset_name_optional": "Init Saw Lead"
  },
  "provenance_pointers": [
    "rule_6ae8cec716982090"
  ],
  "schema_v": "palette_v1",
  "stem": "drums"
}
