{
  "assignment_id": "f832146e79d95c4d9afb1e2ff72922d6",
  "extractor_version": "palette_v1_c31",
  "instrument": "surge_xt",
  "notes_optional": "Surge XT synth snare, retained with weak-combo rationale.",
  "pinned_state": {
    "parameter_dict": {
      "Amp EG Attack": 0.05,
      "Amp EG Release": 0.4,
      "Filter Cutoff": 0.63,
      "Filter Resonance": 0.35,
      "Osc 1 Type": "Classic",
      "Output Level": 0.8
    },
    "plugin_name": "Surge XT",
    "plugin_version": "1.3.4",
    "preset_name_optional": "Init Saw Lead"
  },
  "provenance_pointers": [
    "rule_67d34b1c927ef33d",
    "rule_88b63bd5e771c045"
  ],
  "schema_v": "palette_v1",
  "stem": "drums"
}
