{
  "assignment_id": "9cec11926f4b5de2a58d046617214b99",
  "extractor_version": "palette_v1_c31",
  "instrument": "sfizz",
  "pinned_state": {
    "parameter_dict": {
      "amp_release": 0.15,
      "amp_velocity": 0.9,
      "loop_mode": "no_loop",
      "pitch_keycenter": 60,
      "sample_path": "presets/palette/bass_p1.sfz"
    },
    "plugin_name": "sfizz",
    "plugin_version": "1.2.3"
  },
  "provenance_pointers": [
    "rule_0271c7a9f3b5f606",
    "rule_ca87aa6ad5ff26db"
  ],
  "schema_v": "palette_v1",
  "stem": "bass"
}
