{
  "assignment_id": "97573d187c0453cd9775c48635ef0c24",
  "extractor_version": "palette_v1_c31",
  "instrument": "fluidsynth_gm",
  "pinned_state": {
    "parameter_dict": {
      "bank": 0,
      "gain": 0.9,
      "preset_num": 33
    },
    "plugin_name": "fluidsynth",
    "plugin_version": "2.3.4"
  },
  "provenance_pointers": [
    "rule_0271c7a9f3b5f606"
  ],
  "schema_v": "palette_v1",
  "stem": "bass"
}
