{
  "assignment_id": "4893803382225326bf1c77cb6dad455c",
  "extractor_version": "palette_v1_c31",
  "instrument": "sfizz",
  "pinned_state": {
    "external_state_sha_optional": "c9478179f53df4d5a1f84132be4dc2df35d5a11a8ac3dae04e1bd2ace025900e",
    "parameter_dict": {
      "amp_release": 0.15,
      "amp_velocity": 0.91,
      "loop_mode": "no_loop",
      "pitch_keycenter": 60,
      "sample_path": "presets/palette/bass_p1.sfz"
    },
    "plugin_name": "sfizz",
    "plugin_version": "1.2.3"
  },
  "provenance_pointers": [
    "rule_d85d957a8f59f9f6"
  ],
  "schema_v": "palette_v1",
  "stem": "drums"
}
